{
  "benchmark_id": "bench-svp-001",
  "task_name": "Schema Validator Playground",
  "feature_spec": "benchmark/feature-specs/schema-validator-playground.json",
  "start_time": "2026-04-11T10:00:00Z",
  "end_time": "2026-04-11T10:14:32Z",
  "duration_ms": 872000,
  "status": "pass",
  "files_changed": [
    "src/app/playground/page.tsx",
    "src/components/playground/SchemaSelector.tsx",
    "src/components/playground/JsonEditor.tsx",
    "src/components/playground/ValidationResults.tsx",
    "src/lib/schemas.ts",
    "src/lib/__tests__/schemas.test.ts"
  ],
  "stages": [
    {
      "name": "spec",
      "status": "pass",
      "duration_ms": 45000,
      "notes": "Feature spec defined with 6 acceptance criteria"
    },
    {
      "name": "plan",
      "status": "pass",
      "duration_ms": 62000,
      "notes": "3 tasks identified: schema loader, editor UI, validation engine"
    },
    {
      "name": "build",
      "status": "pass",
      "duration_ms": 540000,
      "notes": "All components implemented with schema selection, JSON editing, and live validation"
    },
    {
      "name": "audit",
      "status": "pass",
      "duration_ms": 120000,
      "notes": "No critical findings. 1 medium: add error boundary. 2 info: style consistency."
    },
    {
      "name": "checkpoint",
      "status": "pass",
      "duration_ms": 15000,
      "notes": "Pre-ship gate: tests passing, lint clean, schemas valid"
    },
    {
      "name": "ship",
      "status": "pass",
      "duration_ms": 90000,
      "notes": "Feature complete. Documentation updated. Benchmark artifact generated."
    }
  ],
  "telemetry": {
    "estimated_tokens": 48500,
    "estimated_cost_usd": 0.73,
    "telemetry_source": "estimated"
  },
  "validation": {
    "tests_run": 12,
    "tests_passed": 12,
    "tests_failed": 0,
    "schema_valid": true,
    "lint_clean": true
  },
  "retries": 0,
  "uncertainty_notes": [
    "Token counts are estimated based on typical prompt/response sizes for similar tasks",
    "Cost estimate uses published API pricing at time of benchmark; actual cost depends on caching and context reuse",
    "Build duration includes human-equivalent estimation for autonomous execution"
  ],
  "artifacts": [
    { "path": "benchmark/feature-specs/schema-validator-playground.json", "type": "spec" },
    { "path": "benchmark/results/schema-validator-playground.json", "type": "result" },
    { "path": "benchmark/results/schema-validator-playground.md", "type": "report" }
  ]
}
